{"schemaVersion":1,"revision":0,"sessionId":7,"symbol":"FPT","drawings":[{"id":"123e4567-e89b-42d3-a456-426614174000","tool":"horizontal","paneId":"price","order":0,"visible":true,"locked":false,"anchors":[{"time":"2026-07-15","price":12345}],"style":{"lineColor":"#E056FD","lineWidth":2,"lineStyle":"solid"},"geometry":{"kind":"horizontal"}}]}
